<?xml version="1.0" encoding="UTF-8"?>
<xs:schema xmlns:xs="http://www.w3.org/2001/XMLSchema">
  <xs:element name="report">
    <xs:complexType>
      <xs:sequence>
        <xs:element name="title" type="xs:string"/>
        <xs:element name="author" type="xs:string"/>
        <xs:element name="id" type="xs:string"/>
        <xs:element name="chapter" maxOccurs="unbounded">
          <xs:complexType>
            <xs:sequence>
              <xs:element name="title" type="xs:string"/>
              <xs:element name="section" maxOccurs="unbounded">
                <xs:complexType>
                  <xs:sequence>
                    <xs:element name="title" type="xs:string"/>
                    <xs:element name="subsection" minOccurs="0" maxOccurs="unbounded">
                      <xs:complexType>
                        <xs:sequence>
                          <xs:element name="title" type="xs:string"/>
                          <xs:element name="item" maxOccurs="unbounded" type="xs:string"/>
                        </xs:sequence>
                        <xs:attribute name="number" type="xs:string" use="required"/>
                      </xs:complexType>
                    </xs:element>
                    <xs:element name="item" maxOccurs="unbounded" type="xs:string"/>
                  </xs:sequence>
                  <xs:attribute name="number" type="xs:string" use="required"/>
                </xs:complexType>
              </xs:element>
            </xs:sequence>
            <xs:attribute name="number" type="xs:string" use="required"/>
          </xs:complexType>
        </xs:element>
      </xs:sequence>
    </xs:complexType>
  </xs:element>
</xs:schema>
